{
  "schema_version": "1.0.0",
  "canonical_revision_id": "rev-27abab12f46ff241d345c40e",
  "ticks_per_quarter": 480,
  "display_policy": "sharp_preferred_v1",
  "measures": [
    {
      "schema_version": "1.0.0",
      "measure_index": 0,
      "start_tick": 0,
      "end_tick": 1920,
      "meter": {
        "schema_version": "1.0.0",
        "tick": 0,
        "numerator": 4,
        "denominator": 4
      },
      "events": [
        {
          "schema_version": "1.0.0",
          "event_kind": "note",
          "start_tick": 0,
          "duration_ticks": 45,
          "canonical_event_id": "ev-1",
          "midi_note": 64,
          "display_pitch": "E4",
          "display_duration": null,
          "derivation": null
        },
        {
          "schema_version": "1.0.0",
          "event_kind": "rest",
          "start_tick": 45,
          "duration_ticks": 435,
          "canonical_event_id": null,
          "midi_note": null,
          "display_pitch": null,
          "display_duration": null,
          "derivation": "global_silence"
        },
        {
          "schema_version": "1.0.0",
          "event_kind": "note",
          "start_tick": 480,
          "duration_ticks": 480,
          "canonical_event_id": "ev-2",
          "midi_note": 64,
          "display_pitch": "E4",
          "display_duration": "quarter",
          "derivation": null
        }
      ]
    }
  ],
  "unsupported_features": [
    {
      "schema_version": "1.0.0",
      "code": "unsupported_display_duration",
      "detail": "45 ticks at 480 PPQ is not an exact simple or single-dotted note value",
      "canonical_event_id": "ev-1",
      "start_tick": 0
    },
    {
      "schema_version": "1.0.0",
      "code": "unsupported_display_duration",
      "detail": "rest of 435 ticks at 480 PPQ is not an exact simple or single-dotted note value",
      "canonical_event_id": null,
      "start_tick": 45
    }
  ]
}
