{
  "schema_version": "1.0.0",
  "canonical_revision_id": "rev-947ea04dbc42d9c94cbb08e6",
  "ticks_per_quarter": 480,
  "display_policy": "sharp_preferred_v1",
  "measures": [
    {
      "schema_version": "1.0.0",
      "measure_index": 0,
      "start_tick": 0,
      "end_tick": 1920,
      "meter": {
        "schema_version": "1.0.0",
        "tick": 0,
        "numerator": 4,
        "denominator": 4
      },
      "events": [
        {
          "schema_version": "1.0.0",
          "event_kind": "note",
          "start_tick": 0,
          "duration_ticks": 480,
          "canonical_event_id": "ev-1",
          "midi_note": 64,
          "display_pitch": "E4",
          "display_duration": "quarter",
          "derivation": null
        },
        {
          "schema_version": "1.0.0",
          "event_kind": "rest",
          "start_tick": 480,
          "duration_ticks": 240,
          "canonical_event_id": null,
          "midi_note": null,
          "display_pitch": null,
          "display_duration": "eighth",
          "derivation": "global_silence"
        },
        {
          "schema_version": "1.0.0",
          "event_kind": "note",
          "start_tick": 720,
          "duration_ticks": 240,
          "canonical_event_id": "ev-2",
          "midi_note": 67,
          "display_pitch": "G4",
          "display_duration": "eighth",
          "derivation": null
        }
      ]
    }
  ],
  "unsupported_features": []
}
